{
  "messageId": "866e6f38-0a26-5d9e-a118-f2e9ba60ecbd",
  "messageType": "analysis.job.run",
  "schemaVersion": "0.6",
  "occurredAt": "2026-10-28T02:00:00Z",
  "tenantId": "e8e2d32b-6fbb-504e-9f08-91b0d3efa6a3",
  "correlationId": "s3-demo-001",
  "jobId": "8b86495a-4ee9-5136-a8c4-cb1ba35244ca",
  "analysisId": "58685092-7782-5bb6-b147-1b73c6047edd",
  "batchId": "e919bf5b-3625-591d-8a23-8f61ef0c0a44",
  "imageFileId": "60b3ce51-0014-51d9-9537-487c84d0b63f",
  "attempt": 1
}
